<?xml version="1.0" encoding="utf-8" ?>
<software version="1.0" xsi:noNamespaceSchemaLocation="Software.xsd" xmlns:xsi="http://www.w3.org/2001/XMLSchema-instance">

    <!-- Sentinel programs -->

    <tool name="Sentinel" description="Corporate data minion" string_id="sentinel_1" movement="1" maxsize="3" level="1">
        <attacks>
            <basicattack name="Swing" damage="2"/>
        </attacks>
    </tool>
    <tool name="Sentinel v2" description="Corporate data soldier" string_id="sentinel_2"  movement="2" maxsize="4" level="2">
        <attacks>
            <basicattack name="Cut" damage="2"/>
        </attacks>
    </tool>
    <tool name="Sentinel v3" description="ACCESS IS DENIED" string_id="sentinel_3"  movement="2" maxsize="4" level="3">
        <attacks>
            <basicattack name="Taser" damage="4"/>
        </attacks>
    </tool>


    <!-- Ranged watchman programs -->

    <tool name="Watchman" description="Corporate first-contact enforcer" string_id="watchman_1" movement="1" maxsize="2" level="1">
        <attacks>
            <basicattack name="poke" range="3" damage="1"/>
        </attacks>
    </tool>
    <tool name="Watchman X" description="Faster, stronger first-contact striker" string_id="watchman_2"  movement="2" maxsize="4" level="2">
        <attacks>
            <basicattack name="Probe" range="3" damage="2"/>
        </attacks>
    </tool>
    <tool name="Watchman SP" description="Qui Custodiet Ipsos Custodes?" string_id="watchman_3"  movement="2" maxsize="4" level="3">
        <attacks>
            <basicattack name="Snipe" range="3" damage="3"/>
        </attacks>
    </tool>


    <!--  Dog programs -->

    <tool name="Guard Pup" description="No bark, very little bite" string_id="dog_1" movement="3" maxsize="2" level="1">
        <attacks>
            <basicattack name="Nibble" damage="2"/>
        </attacks>
    </tool>
    <tool name="Guard Dog" description="Thorough-bred for eliminating intruders" string_id="dog_2"  movement="3" maxsize="3" level="2">
        <attacks>
            <basicattack name="Byte" damage="2"/>
        </attacks>
    </tool>
    <tool name="Attack Dog" description="It'll be over, quickly" string_id="dog_3"  movement="4" maxsize="7" level="3">
        <attacks>
            <basicattack name="Megabyte" damage="3"/>
        </attacks>
    </tool>


    <!-- Warden programs -->

    <tool name="Warden" description="Slow and steady corporate thug" string_id="warden_1" movement="1" maxsize="5" level="1">
        <attacks>
            <basicattack name="Thump" damage="3"/>
        </attacks>
    </tool>
    <tool name="Warden++" description="'Sir, you shouldn't be in here.'" string_id="warden_2"  movement="2" maxsize="6" level="2">
        <attacks>
            <basicattack name="Bash" damage="5"/>
        </attacks>
    </tool>
    <tool name="Warden_ALPHA" description="Puts the 'force' in enforcement"  string_id="warden_3"  movement="3" maxsize="7" level="3">
        <attacks>
            <basicattack name="Crash" damage="7"/>
        </attacks>
    </tool>


    <!-- Ranged static sensor programs -->

    <tool  name="Sensor" description="Long range program eradicator" string_id="sensor_1"  movement="0" maxsize="1" level="2">
        <attacks>
            <basicattack name="Ping" range="5" damage="1"/>
        </attacks>
    </tool>
    <tool name="Sonar" description="Longer range program eradicator" string_id="sensor_2"  movement="0" maxsize="1" level="3">
        <attacks>
        	<basicattack name="Scan" range="8" damage="1"/>
        </attacks>
    </tool>
    <tool name="Radar" description="You're probably in range" string_id="radar_1"  movement="0" maxsize="1" level="4">
        <attacks>
        	<basicattack name="Phase" range="5" damage="2"/>
        </attacks>
    </tool>


    <!-- One offs/boss programs -->

    <tool name="Firewall" description="Defends corporate memory space" string_id="firewall_1"  movement="2" maxsize="20" level="3">
        <attacks>
            <basicattack name="Burn" damage="1"/>
        </attacks>
    </tool>

    <tool name="Sumo" description="A massive, slow moving powerhouse" string_id="esumo_1" movement="12" maxsize="2" level="4">
        <attacks>
            <basicattack name="Dataslam"  damage="6" self-minsize="6" />
        </attacks>
    </tool>

    <tool name="MandelBug" description="Details not disclosed" string_id="bug_2" movement="5" maxsize="1" level="4">
        <attacks>
        	<basicattack name="Exploit"  damage="4"/>
        </attacks>
    </tool>

    <tool name="Boss" description="root@localhost:~#" string_id="boss_1" movement="6" maxsize="25" level="5">
        <attacks>
        	<basicattack name="kill -SIGKILL" range="5" damage="5"/>
        </attacks>
    </tool>
</software>
